{
  "$schema": "./schemas/repositories.schema.json",
  "schemaVersion": 1,
  "snapshotDate": "2026-10-18",
  "statusOwner": "elixpo",
  "verificationMethodology": {
    "checkedAt": "2026-10-18",
    "classificationDecisionUrl": "https://github.com/elixpo/elixpo/blob/main/docs/governance/repository-classification-decisions.md",
    "organizationStateSource": "https://api.github.com/orgs/elixpo/repos?per_page=100&type=all",
    "externalStateSources": [
      "https://api.github.com/repos/pollinations/search.elixpo"
    ],
    "licenseEvidenceUrl": "https://github.com/elixpo/elixpo/blob/main/content/repository-licenses.json",
    "repositoryStandardAssessment": {
      "version": "1.0",
      "assessedAt": "2026-10-18",
      "conformantRepositories": [
        "accounts.elixpo",
        "admin.elixpo",
        "blogs.elixpo",
        "cypher",
        "elixpo",
        "elixpo_chapter",
        "flappy6502",
        "Kareixo",
        "lixrl.com",
        "mails.elixpo",
        "me.elixpo",
        "monodiffuse",
        "Nano28C64",
        "octabit",
        "opensource.elixpo",
        "oreo",
        "packages.elixpo",
        "payouts.elixpo",
        "qfabric",
        "research.elixpo",
        "sketch.elixpo",
        "status.elixpo",
        "wozformer"
      ],
      "conformantWithExceptions": ["agent.elixpo", "crumb.elixpo"],
      "deferredAgentRepositories": ["oreoPI"],
      "outOfScopeRepositories": [".github", "brand-production", "search.elixpo"],
      "centrallyRecordedArchives": [
        "art.elixpo",
        "chat.elixpo",
        "claudeOps.elixpo",
        "clock.elixpo",
        "emoji_transnetv1",
        "falcon",
        "jackey",
        "jackey.elixpo",
        "rewrite.elixpo",
        "romhost32",
        "tommy.elixpo",
        "videolize",
        "wish.elixpo"
      ],
      "archivalRule": "Archived and deleted repositories retain their frozen history. Their lifecycle, custody, support boundary, and license evidence are maintained centrally instead of reopening default branches solely to add templates."
    }
  },
  "entries": [
    {
      "name": ".github",
      "repositoryUrl": "https://github.com/elixpo/.github",
      "disposition": "supporting-repository",
      "publicClass": null,
      "relationship": "core",
      "lifecycle": "active",
      "custody": "elixpo-owned",
      "githubArchived": false,
      "verificationState": "verified",
      "statusVerifiedAt": "2026-10-16",
      "statusOwner": "elixpo",
      "notes": "Organization profile repository; intentionally excluded from the public project catalog."
    },
    {
      "name": "accounts.elixpo",
      "repositoryUrl": "https://github.com/elixpo/accounts.elixpo",
      "disposition": "public-entry",
      "publicClass": "service",
      "relationship": "core",
      "lifecycle": "active",
      "custody": "elixpo-owned",
      "githubArchived": false,
      "verificationState": "verified",
      "statusVerifiedAt": "2026-10-17",
      "statusOwner": "elixpo"
    },
    {
      "name": "admin.elixpo",
      "repositoryUrl": "https://github.com/elixpo/admin.elixpo",
      "disposition": "public-entry",
      "publicClass": "service",
      "relationship": "core",
      "lifecycle": "active",
      "custody": "elixpo-owned",
      "githubArchived": false,
      "verificationState": "verified",
      "statusVerifiedAt": "2026-10-17",
      "statusOwner": "elixpo"
    },
    {
      "name": "agent.elixpo",
      "repositoryUrl": "https://github.com/elixpo/agent.elixpo",
      "disposition": "public-entry",
      "publicClass": "project",
      "relationship": "core",
      "lifecycle": "active",
      "custody": "elixpo-owned",
      "githubArchived": false,
      "verificationState": "verified",
      "statusVerifiedAt": "2026-10-17",
      "statusOwner": "elixpo",
      "notes": "Elixpoo v2 is the active, specialized organization-wide GitHub project-management runtime. It is assessed separately from the ordinary repository workflow baseline because it owns reusable privileged automation; it does not implement product code."
    },
    {
      "name": "art.elixpo",
      "repositoryUrl": "https://github.com/elixpo/art.elixpo",
      "disposition": "public-entry",
      "publicClass": "project",
      "relationship": "core",
      "lifecycle": "archived",
      "custody": "elixpo-owned",
      "githubArchived": true,
      "verificationState": "verified",
      "statusVerifiedAt": "2026-10-17",
      "statusOwner": "elixpo"
    },
    {
      "name": "blogs.elixpo",
      "repositoryUrl": "https://github.com/elixpo/blogs.elixpo",
      "disposition": "public-entry",
      "publicClass": "service",
      "relationship": "core",
      "lifecycle": "active",
      "custody": "elixpo-owned",
      "githubArchived": false,
      "verificationState": "verified",
      "statusVerifiedAt": "2026-10-17",
      "statusOwner": "elixpo"
    },
    {
      "name": "brand-production",
      "repositoryUrl": null,
      "disposition": "supporting-repository",
      "publicClass": null,
      "relationship": "core",
      "lifecycle": "active",
      "custody": "elixpo-owned",
      "githubArchived": false,
      "verificationState": "verified",
      "statusVerifiedAt": "2026-10-17",
      "statusOwner": "elixpo",
      "notes": "Private active production workspace for prompts, generators, print-ready masters, stickers, and other restricted brand material. The portal remains the canonical public brand library."
    },
    {
      "name": "chat.elixpo",
      "repositoryUrl": "https://github.com/elixpo/chat.elixpo",
      "disposition": "public-entry",
      "publicClass": "project",
      "relationship": "core",
      "lifecycle": "archived",
      "custody": "elixpo-owned",
      "githubArchived": true,
      "verificationState": "verified",
      "statusVerifiedAt": "2026-10-17",
      "statusOwner": "elixpo"
    },
    {
      "name": "claudeOps.elixpo",
      "repositoryUrl": "https://github.com/elixpo/claudeOps.elixpo",
      "disposition": "public-entry",
      "publicClass": "project",
      "relationship": "connected",
      "lifecycle": "archived",
      "custody": "elixpo-owned",
      "githubArchived": true,
      "verificationState": "verified",
      "statusVerifiedAt": "2026-10-17",
      "statusOwner": "elixpo",
      "package": {
        "name": "@elixpo/claudeops",
        "versionObserved": "1.0.3",
        "deprecationApproved": true,
        "deprecationApplied": false
      },
      "notes": "Elixpo-owned but not maintained by Elixpo as an active package. The repository is archived and an npm deprecation notice is approved."
    },
    {
      "name": "clock.elixpo",
      "repositoryUrl": "https://github.com/elixpo/clock.elixpo",
      "disposition": "public-entry",
      "publicClass": "project",
      "relationship": "core",
      "lifecycle": "archived",
      "custody": "elixpo-owned",
      "githubArchived": true,
      "verificationState": "verified",
      "statusVerifiedAt": "2026-10-17",
      "statusOwner": "elixpo"
    },
    {
      "name": "crumb.elixpo",
      "repositoryUrl": "https://github.com/elixpo/crumb.elixpo",
      "disposition": "public-entry",
      "publicClass": "project",
      "relationship": "core",
      "lifecycle": "active",
      "custody": "elixpo-owned",
      "githubArchived": false,
      "verificationState": "verified",
      "statusVerifiedAt": "2026-10-18",
      "statusOwner": "elixpo",
      "notes": "Crumb is an active pre-release, self-hosted autonomous agent harness and natural language terminal written in Rust. Crumb owns the local execution, permission, memory, tool, and session boundary; Pollinations supplies its default connected model intelligence."
    },
    {
      "name": "cypher",
      "repositoryUrl": "https://github.com/elixpo/cypher",
      "disposition": "public-entry",
      "publicClass": "project",
      "relationship": "core",
      "lifecycle": "incubating",
      "custody": "elixpo-owned",
      "githubArchived": false,
      "verificationState": "verified",
      "statusVerifiedAt": "2026-10-17",
      "statusOwner": "elixpo"
    },
    {
      "name": "elixpo",
      "repositoryUrl": "https://github.com/elixpo/elixpo",
      "disposition": "supporting-repository",
      "publicClass": null,
      "relationship": "core",
      "lifecycle": "active",
      "custody": "elixpo-owned",
      "githubArchived": false,
      "verificationState": "verified",
      "statusVerifiedAt": "2026-10-17",
      "statusOwner": "elixpo",
      "notes": "Portal source and canonical organization-content repository; not a catalog item."
    },
    {
      "name": "elixpo_chapter",
      "repositoryUrl": "https://github.com/elixpo/elixpo_chapter",
      "disposition": "public-entry",
      "publicClass": "project",
      "relationship": "core",
      "lifecycle": "active",
      "custody": "elixpo-owned",
      "githubArchived": false,
      "verificationState": "verified",
      "statusVerifiedAt": "2026-10-17",
      "statusOwner": "elixpo"
    },
    {
      "name": "emoji_transnetv1",
      "repositoryUrl": "https://github.com/elixpo/emoji_transnetv1",
      "disposition": "public-entry",
      "publicClass": "research",
      "relationship": "core",
      "lifecycle": "archived",
      "custody": "elixpo-owned",
      "githubArchived": true,
      "verificationState": "verified",
      "statusVerifiedAt": "2026-10-17",
      "statusOwner": "elixpo"
    },
    {
      "name": "falcon",
      "repositoryUrl": "https://github.com/elixpo/falcon",
      "disposition": "public-entry",
      "publicClass": "research",
      "relationship": "core",
      "lifecycle": "archived",
      "custody": "elixpo-owned",
      "githubArchived": true,
      "verificationState": "verified",
      "statusVerifiedAt": "2026-10-17",
      "statusOwner": "elixpo"
    },
    {
      "name": "flappy6502",
      "repositoryUrl": "https://github.com/elixpo/flappy6502",